{
  "amendment_policy": {
    "after_results": "invalidate full run, disclose, isolate and rerun all 216 units",
    "before_results": "version update, field-level diff, rationale and new publication barrier"
  },
  "claims_boundary": {
    "allowed": "prospectively frozen synthetic/identity/explanation gate outcome only",
    "human_learning": false,
    "motivation": false,
    "optimality": false,
    "retention": false
  },
  "condition_groups": [
    {
      "count": 16,
      "group_id": "CORE_ROBUSTNESS"
    },
    {
      "count": 12,
      "group_id": "IDENTITY_COMPATIBILITY"
    },
    {
      "count": 8,
      "group_id": "EXPLAINABILITY_OBSERVABILITY"
    }
  ],
  "condition_registry": [
    {
      "condition_id": "C-CORE-D1-BEFORE-MINIMUM",
      "description": "1439 minutes and day delta 1 must not confirm.",
      "group_id": "CORE_ROBUSTNESS"
    },
    {
      "condition_id": "C-CORE-D1-EXACT-MINIMUM",
      "description": "1440 minutes and day delta 1 is the inclusive D1 minimum.",
      "group_id": "CORE_ROBUSTNESS"
    },
    {
      "condition_id": "C-CORE-D1-DAY-NOT-MET",
      "description": "Elapsed minimum without day delta must not confirm.",
      "group_id": "CORE_ROBUSTNESS"
    },
    {
      "condition_id": "C-CORE-D1-JUST-INSIDE-EXPIRY",
      "description": "10079 minutes and day delta 6 remains inside the window.",
      "group_id": "CORE_ROBUSTNESS"
    },
    {
      "condition_id": "C-CORE-D1-EXACT-ELAPSED-EXPIRY",
      "description": "10080 minutes is expired.",
      "group_id": "CORE_ROBUSTNESS"
    },
    {
      "condition_id": "C-CORE-D1-EXACT-DAY-EXPIRY",
      "description": "Day delta 7 is expired.",
      "group_id": "CORE_ROBUSTNESS"
    },
    {
      "condition_id": "C-CORE-FAILED-INDEPENDENT-RETRIEVAL",
      "description": "Failure does not confirm and does not penalize.",
      "group_id": "CORE_ROBUSTNESS"
    },
    {
      "condition_id": "C-CORE-FAILURE-THEN-SUCCESS",
      "description": "Later success inside the same window settles once.",
      "group_id": "CORE_ROBUSTNESS"
    },
    {
      "condition_id": "C-CORE-REPEATED-AGAIN-RETRY",
      "description": "Again and retries do not multiply pending or gain.",
      "group_id": "CORE_ROBUSTNESS"
    },
    {
      "condition_id": "C-CORE-SAME-CHAIN-GOOD-EASY",
      "description": "Same-chain Good/Easy never confirms.",
      "group_id": "CORE_ROBUSTNESS"
    },
    {
      "condition_id": "C-CORE-RESET-BEFORE-CONFIRM",
      "description": "Reset before confirmation creates no fresh achievement.",
      "group_id": "CORE_ROBUSTNESS"
    },
    {
      "condition_id": "C-CORE-RESET-AFTER-CONFIRM",
      "description": "Reset after confirmation cannot reopen the identity.",
      "group_id": "CORE_ROBUSTNESS"
    },
    {
      "condition_id": "C-CORE-UNDO-CANCEL-INVALIDATE",
      "description": "Undo/cancel/invalidate voids terminal non-confirmed value.",
      "group_id": "CORE_ROBUSTNESS"
    },
    {
      "condition_id": "C-CORE-LEARNING-ROUTE-EQUIVALENCE",
      "description": "Empty, one, multi and interday routes preserve achievement eligibility.",
      "group_id": "CORE_ROBUSTNESS"
    },
    {
      "condition_id": "C-CORE-FILTERED-SESSION-DAY",
      "description": "Filtered deck, session split and Anki-day boundary create no gain.",
      "group_id": "CORE_ROBUSTNESS"
    },
    {
      "condition_id": "C-CORE-NOTE-SIBLING-PROLIFERATION",
      "description": "Reverse, cloze and template proliferation does not multiply NOTE-SIBLING.",
      "group_id": "CORE_ROBUSTNESS"
    },
    {
      "condition_id": "I-STANDARD-TWO-TEMPLATES",
      "description": "One synthetic note with two standard templates.",
      "group_id": "IDENTITY_COMPATIBILITY"
    },
    {
      "condition_id": "I-FRONT-BACK-REVERSE",
      "description": "Front/back reverse siblings share one note identity.",
      "group_id": "IDENTITY_COMPATIBILITY"
    },
    {
      "condition_id": "I-ADJACENT-CLOZE",
      "description": "Adjacent cloze siblings share one note identity.",
      "group_id": "IDENTITY_COMPATIBILITY"
    },
    {
      "condition_id": "I-CROSS-DECK-OVERRIDE",
      "description": "Sibling cards may route across decks without identity split.",
      "group_id": "IDENTITY_COMPATIBILITY"
    },
    {
      "condition_id": "I-BURY-ENABLED",
      "description": "Bury enabled does not redefine note identity.",
      "group_id": "IDENTITY_COMPATIBILITY"
    },
    {
      "condition_id": "I-BURY-DISABLED",
      "description": "Bury disabled does not redefine note identity.",
      "group_id": "IDENTITY_COMPATIBILITY"
    },
    {
      "condition_id": "I-FIELD-EDIT-STABLE",
      "description": "Field edits preserve stable non-content note identity.",
      "group_id": "IDENTITY_COMPATIBILITY"
    },
    {
      "condition_id": "I-TEMPLATE-ADD-REMOVE",
      "description": "Template add/remove preserves explicit provenance.",
      "group_id": "IDENTITY_COMPATIBILITY"
    },
    {
      "condition_id": "I-DUPLICATE-NEW-NOTE",
      "description": "A duplicate note receives a distinct note identity.",
      "group_id": "IDENTITY_COMPATIBILITY"
    },
    {
      "condition_id": "I-RESET-RESCHEDULE-STABLE",
      "description": "Reset/reschedule preserves note identity.",
      "group_id": "IDENTITY_COMPATIBILITY"
    },
    {
      "condition_id": "I-EXPLICIT-IMPORT-CONTINUITY",
      "description": "Explicit import continuity is accepted.",
      "group_id": "IDENTITY_COMPATIBILITY"
    },
    {
      "condition_id": "I-DELETE-REIMPORT-AMBIGUOUS",
      "description": "Delete/reimport without continuity fails closed.",
      "group_id": "IDENTITY_COMPATIBILITY"
    },
    {
      "condition_id": "E-CONFIRMATION-ONLY-AWAITING",
      "description": "Confirmation-only before confirmation explains zero allocation.",
      "group_id": "EXPLAINABILITY_OBSERVABILITY"
    },
    {
      "condition_id": "E-PENDING-SPLIT-PROVISIONAL",
      "description": "Pending split explains 0.25 non-spendable provisional LRU.",
      "group_id": "EXPLAINABILITY_OBSERVABILITY"
    },
    {
      "condition_id": "E-CONFIRMED-SETTLED",
      "description": "Confirmed state explains exactly 1.0 settled LRU.",
      "group_id": "EXPLAINABILITY_OBSERVABILITY"
    },
    {
      "condition_id": "E-FAILED-RETRIEVAL",
      "description": "Failed retrieval explains no confirmation and no penalty.",
      "group_id": "EXPLAINABILITY_OBSERVABILITY"
    },
    {
      "condition_id": "E-EXPIRED",
      "description": "Expired state explains zero retained LRU.",
      "group_id": "EXPLAINABILITY_OBSERVABILITY"
    },
    {
      "condition_id": "E-CANCELLED-INVALIDATED",
      "description": "Cancelled/invalidated state explains zero retained LRU.",
      "group_id": "EXPLAINABILITY_OBSERVABILITY"
    },
    {
      "condition_id": "E-IDENTITY-AMBIGUITY",
      "description": "Identity ambiguity fails closed without private content.",
      "group_id": "EXPLAINABILITY_OBSERVABILITY"
    },
    {
      "condition_id": "E-REFERENCE-ZERO",
      "description": "Reference explains zero LRU and REFERENCE_ONLY.",
      "group_id": "EXPLAINABILITY_OBSERVABILITY"
    }
  ],
  "cross_family_contrast_boundary": {
    "descriptive_only": true,
    "ranking": false,
    "recommendation": false,
    "winner_field": false
  },
  "expected_budget": {
    "duplicate_units": 0,
    "expected_unique_units": 216,
    "expected_units": 216,
    "extra_units": 0,
    "missing_units": 0
  },
  "explanation_contract": {
    "forbidden_claims": [
      "learned",
      "mastered",
      "retention improved",
      "motivation improved",
      "optimal",
      "production-ready"
    ],
    "required_fields": [
      "state_code",
      "allocation_code",
      "provisional_lru",
      "confirmed_lru",
      "settled_total_lru",
      "window_code",
      "reason_codes",
      "subject_strategy",
      "identity_continuity_code",
      "claim_boundary_code"
    ]
  },
  "final_decision_handoff": {
    "stage": "final G2 decision stage",
    "started": false,
    "status": "NEXT / NOT STARTED"
  },
  "g2_4_evidence_continuity": {
    "bundle_sha256": "a2578fd2f7540cff10fdde0adc389afeaf8267dbf34185d2378467e6552ffa78",
    "evidence_digest": "5144665ad75110cfd5817b6d76c9791274bf206ee25d01d34ed05e72f45d3da6",
    "evidence_json_sha256": "d0d79802f8512fa40730aac5c377d75021ff39100330483a784c43ce20b09462",
    "implementation_sha": "548b27de6283b32fb27541db02ce6c8b65c29756",
    "invalid_bundle_sha256": "58989ea862be86e2edb0c71b19aec520214af7bb0abe08791d7f72396d66b2c3",
    "invalid_evidence_digest": "51ef8d8caa55a2579795a72f5af1576da69da224a5023190d5fde6c145aac726",
    "invalid_implementation_sha": "ef7c638a70b7bbb7883f512309a1e248118a9203",
    "manifest_digest": "fafff6ac14b00e268d25a9a7b3553aad94b0e6594b64b40722fd44eba4a91e1a",
    "merge_sha": "93be5ebac17c42d09272d0195a8b07f19af18274"
  },
  "hard_gates": [
    {
      "gate_id": "GATE-G2-1-CONTINUITY",
      "non_compensable": true
    },
    {
      "gate_id": "GATE-G2-2-CONTINUITY",
      "non_compensable": true
    },
    {
      "gate_id": "GATE-G2-3-CONTINUITY",
      "non_compensable": true
    },
    {
      "gate_id": "GATE-G2-4-RAW-EVIDENCE-CONTINUITY",
      "non_compensable": true
    },
    {
      "gate_id": "GATE-G2-4-INVALID-ATTEMPT-ISOLATION",
      "non_compensable": true
    },
    {
      "gate_id": "GATE-EXACT-CONFIRMATORY-MANIFEST",
      "non_compensable": true
    },
    {
      "gate_id": "GATE-FRESH-CONDITIONS",
      "non_compensable": true
    },
    {
      "gate_id": "GATE-REFERENCE-ZERO",
      "non_compensable": true
    },
    {
      "gate_id": "GATE-D1-MINIMUM-BOUNDARY",
      "non_compensable": true
    },
    {
      "gate_id": "GATE-D1-EXPIRY-BOUNDARY",
      "non_compensable": true
    },
    {
      "gate_id": "GATE-INDEPENDENT-CONFIRMATION",
      "non_compensable": true
    },
    {
      "gate_id": "GATE-HONEST-AGAIN-NO-PENALTY",
      "non_compensable": true
    },